<?xml version="1.0" encoding="UTF-8"?>
<!DOCTYPE Courses SYSTEM "CourseModel-Initial.dtd">
<Courses>
    <Course>
        <UID>1</UID>
        <CourseCCN>41613</CourseCCN>
        <CourseSemester>Fall 2013</CourseSemester>
        <CourseCode>INFORMATION 242</CourseCode>
        <CourseShortCode>INFO 242</CourseShortCode>
        <CourseDepartmentalCode>i242</CourseDepartmentalCode>
        <CourseTitle>XML Foundations</CourseTitle>
        <CourseDescriptions>
            <GeneralCatalog>The Extensible Markup Language (XML), with its ability to define formal
                structural and semantic definitions for metadata and information models, is the key
                enabling technology for information services and document-centric business models
                that use the Internet and its family of protocols. This course introduces XML
                syntax, transformations, schema languages and the querying of XML databases. It
                balances conceptual topics with practical skills for designing, implementing, and
                handling conceptual models as XML schemas.</GeneralCatalog>
            <DepartmentDescription>Three hours of lecture. The Extensible Markup Language (XML),
                with its ability to define formal structural and semantic definitions for metadata
                and information models, is the key enabling technology for information services and
                document-centric business models that use the Internet and its family of protocols.
                This course introduces XML syntax, transformations, schema languages, and the
                querying of XML databases. It balances conceptual topics with practical skills for
                designing, implementing, and handling conceptual models as XML
                schemas.</DepartmentDescription>
        </CourseDescriptions>
        <Department>School of Information</Department>
                <Units>3</Units>
        <CourseFormat>
            <CourseFormatOption>
                <CourseHours>3</CourseHours>
                <CourseFormatType>Lecture</CourseFormatType>
                <CourseFormatFrequency>Weekly</CourseFormatFrequency>
            </CourseFormatOption>
        </CourseFormat>
        <CourseStartDate>2013-08-27</CourseStartDate>
        <CourseEndDate>2013-12-20</CourseEndDate>
        <Sections>
            <Section>
                <SectionTitle>Lecture</SectionTitle>
                <SectionCode>Lecture01</SectionCode>
                <SectionShortCode>LEC 01</SectionShortCode>
                <SectionCCN>41613</SectionCCN>
                <SectionType>Lecture</SectionType>
                <SectionInstructor>Erik Wilde</SectionInstructor>
                <SectionSchedule>
                    <SectionScheduleEntry>
                        <ScheduledTime>
                            <Day>Monday</Day>
                            <Day>Wednesday</Day>
                            <StartTime>14:00</StartTime>
                            <EndTime>15:30</EndTime>
                            <Frequency>Weekly</Frequency>
                        </ScheduledTime>
                        <ScheduledLocation>
                            <Building>South Hall</Building>
                            <Room>202</Room>
                        </ScheduledLocation>
                    </SectionScheduleEntry>
              </SectionSchedule>
            </Section>
        </Sections>
        <Instructors>
            <Instructor>
                <InstructorName>Erik Wilde</InstructorName>
                <InstructorType>Professor</InstructorType>
                <InstructorEmail>dret@ischool.berkeley.edu</InstructorEmail>
                <InstructorLink></InstructorLink>
            </Instructor>
            <Instructor>
                <InstructorName>Remond Yee</InstructorName>
                <InstructorType>Guest Professor</InstructorType>
                <InstructorEmail></InstructorEmail>
                <InstructorLink></InstructorLink>
            </Instructor>
            <Instructor>
                <InstructorName>Eric C. Kansa</InstructorName>
                <InstructorType>Guest Speaker</InstructorType>
                <InstructorEmail>Some Company</InstructorEmail>
                <InstructorLink></InstructorLink>
            </Instructor>
        </Instructors>
        <!-- What about flex units?-->
        <Grading>
            <CreditOptions>Rigid</CreditOptions>
            
            <GradingOptions>
                <GradingOption>Graded</GradingOption>
                <GradingOption>Pass Fail</GradingOption>
            </GradingOptions>
           
            <GradingBreakdown>
                <GradingElement>
                    <GradingElementTitle>Assignments</GradingElementTitle>
                    <!-- free text -->
                    <GradingElementType>Assignment</GradingElementType>
                   
                    <GradingElementWeight>0.25</GradingElementWeight>
                </GradingElement>
                <GradingElement>
                    <GradingElementTitle>Final Project Report</GradingElementTitle>
                    <GradingElementType>Project</GradingElementType>
                    <GradingElementWeight>0.25</GradingElementWeight>
                </GradingElement>
                <GradingElement>
                    <GradingElementTitle>Final Exam (Oral)</GradingElementTitle>
                    <GradingElementType>Final Exam</GradingElementType>
                    <GradingElementWeight>0.5</GradingElementWeight>
                </GradingElement>
            </GradingBreakdown>
        </Grading>
        <Milestones>
            <Milestone>
                <MilestoneTitle>Final Exam</MilestoneTitle>
                <MilestoneType>Final Exam</MilestoneType>
                <!-- Project, Report, Essay, Midterm, Final Exam -->
                <MilestoneDueDate>2013-12-17</MilestoneDueDate>
                <MilestoneDueTime>10:00</MilestoneDueTime>
                <MilestoneDueLocation>Southall 202</MilestoneDueLocation>
            </Milestone>
            <Milestone>
                <MilestoneTitle>Mid Term Exam</MilestoneTitle>
                <MilestoneType>Mid TermExam</MilestoneType>
                <!-- Project, Report, Essay, Midterm, Final Exam -->
                <MilestoneDueDate>2013-11-05</MilestoneDueDate>
                <MilestoneDueTime>09:00</MilestoneDueTime>
                <MilestoneDueLocation>Southall 202</MilestoneDueLocation>
            </Milestone>
        </Milestones>
        <ClassPerformance>
            <Grades>
                <StudentGrades>
                    <StudentGrade/>
                    <!-- A+ ... F-->
                </StudentGrades>
                <ClassAverage/>
            </Grades>
            <InstructorEvaluation>
                <!-- ADD MORE DETAILS HERE IF NECCESSARY -->
            </InstructorEvaluation>
        </ClassPerformance>
        <PreviousCourseCCN>40000</PreviousCourseCCN>
        <FinalExamGroup>None</FinalExamGroup>
        <!-- What is this?-->
        <Restrictions>
            <!-- need a list of restrictions-->
            <Restriction>By Category</Restriction>
        </Restrictions>
        <Notes/>
        <Prerequisites>
        </Prerequisites>
        <EquivilantCourses>
            <!-- links to any equivlant courses in the current semester -->
            <EquivalentCourseCCN/>
        </EquivilantCourses>
        <CourseEntryStatus>
            <CreatedOn>2013-03-08</CreatedOn>
            <CreatedBy>UNKNOWN</CreatedBy>
            <ModifiedOn/>
            <ModifiedBy/>
        </CourseEntryStatus>
        <Enrolment>
            <EnrolmentStatus>
                <EnrolmentUpdate>
                    <EnrolmentUpdatedOn>2013-10-09</EnrolmentUpdatedOn>
                    <Limit>35</Limit>
                    <Enrolled>17</Enrolled>
                    <Waitlist>0</Waitlist>
                    <AvailableSeats>18</AvailableSeats>
                </EnrolmentUpdate>
            </EnrolmentStatus>
        </Enrolment>
        <Fulfilments>
            <Fulfilment>
                <Degree>MIMS</Degree>
                <Department>School of Information</Department>
                <Requirement>Technology</Requirement>
                <FullfillmentType>Major<!--Minor, major...etc--></FullfillmentType>
            </Fulfilment>
        </Fulfilments>
    </Course>
    <Course>
        <UID>2</UID>
        <CourseCCN>41578</CourseCCN>
        <CourseSemester>Fall 2013</CourseSemester>
        <CourseCode>INFORMATION 202</CourseCode>
        <CourseShortCode>INFO 202</CourseShortCode>
        <CourseDepartmentalCode>i202</CourseDepartmentalCode>
        <CourseTitle>Information Organization and Retrieval</CourseTitle>
        <CourseAlternariveTitles>
            <AlternativeTitle>IOR</AlternativeTitle>
        </CourseAlternariveTitles>
        <CourseDescriptions>
            <GeneralCatalog>Organization, representation, and access to information. Categorization,
                indexing, and content analysis. Data structures. Design and maintenance of
                databases, indexes, classification schemes, and thesauri. Use of codes, formats, and
                standards. Analysis and evaluation of search and navigation
                techniques.</GeneralCatalog>
            <DepartmentDescription>Three hours of lecture per week. This course introduces the
                intellectual foundations of information organization and retrieval: conceptual
                modeling, semantic representation, vocabulary and metadata design, classification,
                and standardization, as well as information organization and retrieval practices,
                technology, and applications, including computational processes for analyzing
                information in both textual and non-textual formats. Students will learn how